{
  "schema": "pm-export/v0.2",
  "generated_from": {
    "commit": "80ec90f",
    "at": "2026-07-15T00:00:00Z",
    "sources": [
      "work-orders/WO-0001.md",
      "capability-map.md",
      "ledger.md"
    ]
  },
  "status_model": "Constitution §8 work-order states + capability-map markers (queued, delivered) + ledger statuses (open, resolved, archived). Target-tool status mapping lives in skills/pm-export/SKILL.md.",
  "items": [
    {
      "id": "F-001",
      "kind": "epic",
      "source": {
        "path": "capability-map.md",
        "artifact_class": "Capability Map",
        "anchor": "F-001"
      },
      "title": "BOOTSTRAP",
      "body": "Repo foundation: north-star artifacts + work-order machinery (brownfield v4). Realized by WO-0001.",
      "status": "review",
      "priority": null,
      "estimate": null,
      "labels": [
        "capability:self-hosting-bundle"
      ],
      "parent": null,
      "relations": [],
      "assignee": null,
      "sync": {},
      "source_hash": "sha256:f86d1ce0ebe23c8e0fd759ba8f885c523ad04fed9e52283d904aba7e8a8ac339",
      "native": {}
    },
    {
      "id": "F-002",
      "kind": "epic",
      "source": {
        "path": "capability-map.md",
        "artifact_class": "Capability Map",
        "anchor": "F-002"
      },
      "title": "Artifact templates",
      "body": "Charter, constitution, domain-model, contracts, capability-map, feature, ADR, ledger templates — each with a governance header + authoring instructions. Planned work order: WO-0002 (not yet cut).",
      "status": "queued",
      "priority": null,
      "estimate": null,
      "labels": [
        "capability:self-hosting-bundle"
      ],
      "parent": null,
      "relations": [],
      "assignee": null,
      "sync": {},
      "source_hash": "sha256:1d247924880fe2539c6f08cce9c0093aeb9fdcfa9bb8d5a093e3f14ef329cf34",
      "native": {}
    },
    {
      "id": "F-003",
      "kind": "epic",
      "source": {
        "path": "capability-map.md",
        "artifact_class": "Capability Map",
        "anchor": "F-003"
      },
      "title": "Schemas",
      "body": "Feature and capability-map frontmatter schemas. Planned work order: WO-0003 (not yet cut).",
      "status": "queued",
      "priority": null,
      "estimate": null,
      "labels": [
        "capability:self-hosting-bundle"
      ],
      "parent": null,
      "relations": [],
      "assignee": null,
      "sync": {},
      "source_hash": "sha256:5cdaea25ea26adbbc52c2f5fb545510d81af662bdf1505c847dd60978c229b5e",
      "native": {}
    },
    {
      "id": "F-004",
      "kind": "epic",
      "source": {
        "path": "capability-map.md",
        "artifact_class": "Capability Map",
        "anchor": "F-004"
      },
      "title": "Playbooks & commands",
      "body": "Intake, specification, implementation, verification/repair, and change-order playbooks & commands. Planned work order: WO-0004 (not yet cut).",
      "status": "queued",
      "priority": null,
      "estimate": null,
      "labels": [
        "capability:self-hosting-bundle"
      ],
      "parent": null,
      "relations": [],
      "assignee": null,
      "sync": {},
      "source_hash": "sha256:9a302cd24671255ed3c39ee6ea757ae841408e88572fd964cbd97db2a35588a8",
      "native": {}
    },
    {
      "id": "F-005",
      "kind": "epic",
      "source": {
        "path": "capability-map.md",
        "artifact_class": "Capability Map",
        "anchor": "F-005"
      },
      "title": "README & design notes",
      "body": "Full README rewrite + lineage essay (stepwise refinement, AV/construction work orders, Ansible, CI/CD). Planned work order: WO-0005 (not yet cut).",
      "status": "queued",
      "priority": null,
      "estimate": null,
      "labels": [
        "capability:self-hosting-bundle"
      ],
      "parent": null,
      "relations": [],
      "assignee": null,
      "sync": {},
      "source_hash": "sha256:a886b11b560c5484e91ca562eef04a962ca071d227c0419fe0bc97fe7c7f25b5",
      "native": {}
    },
    {
      "id": "F-006",
      "kind": "epic",
      "source": {
        "path": "capability-map.md",
        "artifact_class": "Capability Map",
        "anchor": "F-006"
      },
      "title": "Worked example",
      "body": "Candidate: promote this bootstrap's own artifacts to /examples/. Planned work order: WO-0006 (not yet cut).",
      "status": "queued",
      "priority": null,
      "estimate": null,
      "labels": [
        "capability:self-hosting-bundle"
      ],
      "parent": null,
      "relations": [],
      "assignee": null,
      "sync": {},
      "source_hash": "sha256:14753d65f8155d79a9461be90a8fc2368a2ee69dc73d4d6f05ec2083e1277e45",
      "native": {}
    },
    {
      "id": "F-007",
      "kind": "epic",
      "source": {
        "path": "capability-map.md",
        "artifact_class": "Capability Map",
        "anchor": "F-007"
      },
      "title": "Adapter shims",
      "body": "CLAUDE.md + Copilot instruction templates; pointers only, one screen max. Planned work order: WO-0007 (not yet cut).",
      "status": "queued",
      "priority": null,
      "estimate": null,
      "labels": [
        "capability:self-hosting-bundle"
      ],
      "parent": null,
      "relations": [],
      "assignee": null,
      "sync": {},
      "source_hash": "sha256:efed03d74489feeaf23f7bad055cbd9f23f9a939fb7461942826a963933a7f23",
      "native": {}
    },
    {
      "id": "F-008",
      "kind": "epic",
      "source": {
        "path": "capability-map.md",
        "artifact_class": "Capability Map",
        "anchor": "F-008"
      },
      "title": "Common rules",
      "body": "6 always-apply rule files in rules/common/. Delivered outside the work-order system (Ledger L-011).",
      "status": "delivered",
      "priority": null,
      "estimate": null,
      "labels": [
        "capability:library-layer"
      ],
      "parent": null,
      "relations": [],
      "assignee": null,
      "sync": {},
      "source_hash": "sha256:c364f237426b30df48147567535fd446ac657facb767e0158b53502c7d0129f7",
      "native": {}
    },
    {
      "id": "F-009",
      "kind": "epic",
      "source": {
        "path": "capability-map.md",
        "artifact_class": "Capability Map",
        "anchor": "F-009"
      },
      "title": "Language rule stubs",
      "body": "TypeScript, Python, Go rule stubs in rules/<lang>/. Delivered outside the work-order system (Ledger L-011); stubs unpopulated (L-013).",
      "status": "delivered",
      "priority": null,
      "estimate": null,
      "labels": [
        "capability:library-layer"
      ],
      "parent": null,
      "relations": [],
      "assignee": null,
      "sync": {},
      "source_hash": "sha256:59e9843a7a34b4e7026a14a0f6108b8e215637dbdc09bc9131fcd4f85dc3cc24",
      "native": {}
    },
    {
      "id": "F-010",
      "kind": "epic",
      "source": {
        "path": "capability-map.md",
        "artifact_class": "Capability Map",
        "anchor": "F-010"
      },
      "title": "Development agents",
      "body": "5 subagent definitions in agents/: architect, code-reviewer, security-reviewer, spec-miner, silent-failure-hunter. Delivered outside the work-order system (Ledger L-011).",
      "status": "delivered",
      "priority": null,
      "estimate": null,
      "labels": [
        "capability:library-layer"
      ],
      "parent": null,
      "relations": [],
      "assignee": null,
      "sync": {},
      "source_hash": "sha256:2fd71faf38b98bf8eb1827a9f4bd6b50172a7393323cc65fc95783ce268d06c7",
      "native": {}
    },
    {
      "id": "F-011",
      "kind": "epic",
      "source": {
        "path": "capability-map.md",
        "artifact_class": "Capability Map",
        "anchor": "F-011"
      },
      "title": "Governance agents",
      "body": "3 subagent definitions in agents/: planner, builder, gatekeeper. Delivered outside the work-order system (Ledger L-011).",
      "status": "delivered",
      "priority": null,
      "estimate": null,
      "labels": [
        "capability:library-layer"
      ],
      "parent": null,
      "relations": [],
      "assignee": null,
      "sync": {},
      "source_hash": "sha256:7890d429586f6b1d4b487b28a663ee73a303511c8ea827efc4e664d6206e40b0",
      "native": {}
    },
    {
      "id": "F-012",
      "kind": "epic",
      "source": {
        "path": "capability-map.md",
        "artifact_class": "Capability Map",
        "anchor": "F-012"
      },
      "title": "Skills",
      "body": "7 invokable skills in skills/ (initial batch): ADR, multi-agent exploration, project philosophy, work-order intake, deep research, code review, session handoff. Delivered outside the work-order system (Ledger L-011).",
      "status": "delivered",
      "priority": null,
      "estimate": null,
      "labels": [
        "capability:library-layer"
      ],
      "parent": null,
      "relations": [],
      "assignee": null,
      "sync": {},
      "source_hash": "sha256:86a1faa05a3f7cf79afabe91bbb97df61da3c0f814773a6e95fb5905807db7a3",
      "native": {}
    },
    {
      "id": "F-013",
      "kind": "epic",
      "source": {
        "path": "capability-map.md",
        "artifact_class": "Capability Map",
        "anchor": "F-013"
      },
      "title": "Installation profiles",
      "body": "3 manifests in profiles/: Minimal, Standard, Full. Delivered outside the work-order system (Ledger L-011).",
      "status": "delivered",
      "priority": null,
      "estimate": null,
      "labels": [
        "capability:library-layer"
      ],
      "parent": null,
      "relations": [],
      "assignee": null,
      "sync": {},
      "source_hash": "sha256:487bddf2bb1f2ca5285048675598029caf9e0a1a479525e7f63ae97e777c4c71",
      "native": {}
    },
    {
      "id": "F-014",
      "kind": "epic",
      "source": {
        "path": "capability-map.md",
        "artifact_class": "Capability Map",
        "anchor": "F-014"
      },